{
  "schema_version": "1.0.0",
  "fixture_data": true,
  "task_id": "script_task_demo_001",
  "product_id": "product_demo_001",
  "product_revision": 1,
  "source_analysis_id": "analysis_demo_001",
  "source_analysis_revision": 1,
  "pattern_id": "pattern_demo_001",
  "content_goal": "seeding",
  "target_audience": "需要通勤外套的成年男性",
  "version_count": 3,
  "status": "completed",
  "progress": 100,
  "current_step": "completed",
  "attempt_count": 1,
  "max_attempts": 3,
  "input_ref": "script_input_demo_001",
  "result_ref": "script_result_demo_001",
  "script_id": "script_demo_001",
  "error": null,
  "created_at": "2026-08-29T06:09:00Z",
  "updated_at": "2026-08-29T06:10:00Z"
}
